{
  "id": "ecommerce-1440",
  "family": "commercial",
  "nameAr": "نظام التجارة الإلكترونية",
  "nameEn": "E-Commerce Law",
  "decree": "م/126",
  "hijriDate": "7/11/1440",
  "gregorianYear": 2019,
  "status": "in_force",
  "totalArticles": 26,
  "articles": [
    {
      "no": 5,
      "titleAr": "حماية بيانات المستهلك",
      "text": "على موفر الخدمة حماية البيانات الشخصية للمستهلك واتصالاته، وعدم الاحتفاظ بها مدةً تزيد على ما تقتضيه طبيعة التعامل، ويُحظر استخدامها أو الإفصاح عنها دون موافقة المستهلك ما لم يقضِ نظام آخر بغير ذلك.",
      "verbatim": false,
      "tags": [
        "بيانات",
        "خصوصيه",
        "معلومات العملاء",
        "افصاح",
        "موافقه"
      ]
    },
    {
      "no": 6,
      "titleAr": "بيانات المتجر الواجب الإفصاح عنها",
      "text": "على موفر الخدمة الإفصاح في محله الإلكتروني عن: اسمه أو بيان مميز له وعنوانه، ووسائل الاتصال به، واسم السجل المقيد فيه ورقمه إن وُجد، والبيانات الأخرى التي تحددها اللائحة.",
      "verbatim": true,
      "tags": [
        "بيانات المتجر",
        "سجل تجاري",
        "عنوان",
        "تواصل",
        "افصاح"
      ]
    },
    {
      "no": 10,
      "titleAr": "الإعلان الإلكتروني وثيقة تعاقدية مُلزِمة",
      "text": "يُعدّ الإعلان الإلكتروني وثيقة تعاقدية مُلزِمة، ويجب أن يتضمن اسم المنتج أو الخدمة، واسم موفر الخدمة ووسائل الاتصال به، والبيانات الأخرى التي تحددها اللائحة.",
      "verbatim": false,
      "tags": [
        "اعلان",
        "ملزم",
        "تعاقد",
        "دعايه"
      ]
    },
    {
      "no": 11,
      "titleAr": "المحظور في الإعلان الإلكتروني",
      "text": "يُحظر تضمين الإعلان الإلكتروني: عرضاً كاذباً أو مصوغاً بعبارات تؤدي إلى خداع المستهلك أو تضليله، أو شعاراً أو علامة تجارية دون حق الاستعمال أو علامة مقلدة.",
      "verbatim": true,
      "tags": [
        "اعلان مضلل",
        "كاذب",
        "خداع",
        "تضليل",
        "علامه تجاريه",
        "مقلد"
      ]
    },
    {
      "no": 13,
      "titleAr": "حق المستهلك في فسخ العقد خلال سبعة أيام",
      "text": "للمستهلك فسخ العقد خلال الأيام السبعة التالية لتسلمه المنتج أو التعاقد على الخدمة، ما لم يستخدم المنتج أو يستفد من الخدمة.",
      "verbatim": true,
      "tags": [
        "ارجاع",
        "استرجاع",
        "فسخ",
        "الغاء",
        "سبعه ايام",
        "رجع",
        "استبدال"
      ]
    },
    {
      "no": 14,
      "titleAr": "الفسخ عند تأخّر التسليم",
      "text": "يحق للمستهلك فسخ العقد إذا تأخر موفر الخدمة عن التسليم مدة تزيد على خمسة عشر يوماً، واسترجاع ما دفعه مقابل المنتج أو الخدمة.",
      "verbatim": true,
      "tags": [
        "تاخر",
        "تسليم",
        "شحن",
        "لم يصل",
        "خمسه عشر"
      ]
    },
    {
      "no": 18,
      "titleAr": "العقوبات",
      "text": "يُعاقب مخالف أحكام النظام أو اللائحة بواحدة أو أكثر من: الإنذار، أو غرامة لا تزيد على **مليون (1,000,000) ريال**، أو إيقاف نشاط التجارة الإلكترونية مؤقتاً أو دائماً، أو حجب المحل الإلكتروني جزئياً أو كلياً.",
      "verbatim": false,
      "tags": [
        "عقوبه",
        "غرامه",
        "مخالفه",
        "حجب",
        "ايقاف"
      ]
    }
  ],
  "penaltyAmounts": [
    1000000
  ],
  "appliesTo": [
    "متجر إلكتروني",
    "بيع عن بُعد",
    "إعلان إلكتروني",
    "إرجاع",
    "تأخر التسليم",
    "بيانات المستهلك"
  ],
  "verification": {
    "metadata": "secondary_source",
    "articles": "two_secondary_sources",
    "checkedAt": "2026-08-21",
    "sources": [
      "https://tasbeeb.ensyte.sa/laws/public-administration/e-commerce",
      "https://nezams.com/نظام-التجارة-الإلكترونية/"
    ],
    "notes": "مصدران مستقلان اتفقا على العدد الإجمالي (26) وعلى نصّ المواد 6 و13 و18."
  }
}
