{
  "id": "vat-1438",
  "family": "financial",
  "nameAr": "نظام ضريبة القيمة المضافة",
  "status": "unverified",
  "articles": [],
  "appliesTo": [
    "ضريبة",
    "قيمة مضافة",
    "فاتورة ضريبية",
    "إقرار"
  ],
  "verification": {
    "metadata": "unverified",
    "articles": "none",
    "checkedAt": "2026-08-21",
    "sources": [],
    "notes": "النظام مدرج للتوجيه فقط: العقل يعرف أن المسألة تقع تحته، لكن لا يُستشهد بمادة ولا برقم غرامة منه حتى يُتحقَّق من متنه."
  }
}
