{
  "id": "e-invoicing",
  "family": "financial",
  "nameAr": "الفوترة الإلكترونية (لائحة وقرارات هيئة الزكاة والضريبة والجمارك)",
  "status": "in_force",
  "appliesTo": [
    "فوترة إلكترونية",
    "فاتورة إلكترونية",
    "zatca",
    "ربط الفوترة",
    "المرحلة الثانية"
  ],
  "articles": [],
  "verification": {
    "metadata": "unverified",
    "articles": "none",
    "checkedAt": "2026-08-21",
    "sources": [],
    "notes": "ليست نظاماً بمرسوم ملكي بل لائحة وقرارات صادرة عن هيئة الزكاة والضريبة والجمارك. ⚠️ مخالفات الفوترة تُعاقَب عبر **نظام ضريبة القيمة المضافة** (المادة 45: حتى 50,000 ريال عن كل فترة ضريبية) — لا تخترع لها عقوبة مستقلة."
  }
}
