{
  "id": "commercial-register-1446",
  "family": "commercial",
  "nameAr": "نظام السجل التجاري",
  "nameEn": "Commercial Register Law",
  "decree": "م/83",
  "hijriDate": "19/3/1446",
  "gregorianYear": 2024,
  "status": "in_force",
  "totalArticles": 29,
  "supersedes": [
    "نظام السجل التجاري الصادر بالمرسوم الملكي م/1 وتاريخ 21/2/1416هـ"
  ],
  "appliesTo": [
    "اسم تجاري",
    "تجديد",
    "تجديد السجل",
    "سجل تجاري",
    "شطب السجل",
    "فرع",
    "فرع جديد",
    "قيد",
    "نشاط تجاري",
    "نشاط غير مدرج"
  ],
  "articles": [],
  "verification": {
    "metadata": "secondary_source",
    "articles": "none",
    "checkedAt": "2026-08-22",
    "sources": [
      "https://ahmedalmalki.sa/blog/commercial-register-saudi-2026",
      "https://qanoonsa.com/p/505002/"
    ],
    "notes": "نظام **جديد** صدر بالمرسوم م/83 (19/3/1446هـ) ونُشر 4 أكتوبر 2024 ونفذ بعد 180 يوماً — أي من **3 أبريل 2025م** — وحلّ محلّ نظام 1416هـ. أبرز تغييره: **سجل تجاري واحد موحّد** للمنشأة وتُسجَّل الفروع ضمنه بلا سجل مستقل. 🔴 **العقوبات ليست مبالغ ثابتة في متن النظام** بل تتبع **جدول الجزاءات المعتمد من وزارة التجارة** وهو قابل للتعديل — فلا يجوز ذكر رقم غرامة لهذا النظام."
  },
  "aliases": []
}
