{
  "id": "companies-1443",
  "family": "commercial",
  "nameAr": "نظام الشركات",
  "nameEn": "Companies Law",
  "decree": "م/132",
  "hijriDate": "1/12/1443",
  "gregorianYear": 2022,
  "status": "in_force",
  "totalArticles": 281,
  "supersedes": [
    "نظام الشركات الصادر بالمرسوم الملكي م/3 وتاريخ 28/1/1437هـ",
    "نظام الشركات المهنية الصادر بالمرسوم الملكي م/17 وتاريخ 26/1/1441هـ"
  ],
  "appliesTo": [
    "تأسيس شركة",
    "شريك",
    "شركاء",
    "حصص",
    "أسهم",
    "تصفية",
    "مجلس إدارة",
    "شركة ذات مسؤولية محدودة",
    "انسحاب شريك",
    "تنازل عن حصص",
    "شركة تضامن"
  ],
  "articles": [
    {
      "no": 4,
      "titleAr": "أشكال الشركات",
      "verbatim": true,
      "text": "تتخذ الشركة التي تؤسس وفقاً لأحكام النظام أحد الأشكال الآتية: (أ) شركة التضامن. (ب) شركة التوصية البسيطة. (ج) شركة المساهمة. (د) شركة المساهمة المبسطة. (هـ) الشركة ذات المسؤولية المحدودة.",
      "tags": [
        "اشكال",
        "تضامن",
        "توصيه",
        "مساهمه",
        "مسؤوليه محدوده"
      ]
    },
    {
      "no": 45,
      "titleAr": "انضمام الشريك أو انسحابه أو إخراجه أو تنازله",
      "verbatim": false,
      "text": "(1) إذا انضمّ شريك جديد إلى الشركة بحصة جديدة كان مسؤولاً شخصياً في جميع أمواله وبالتضامن مع باقي الشركاء عن ديون الشركة **السابقة واللاحقة** لانضمامه؛ ومع ذلك يجوز الاتفاق على إعفائه من المسؤولية عن الديون السابقة بإجماع الشركاء، ويسري هذا الاتفاق في مواجهة الدائنين من تاريخ قيده وشهره لدى السجل التجاري. (2) إذا انسحب شريك أو أُخرج من الشركة فلا يكون مسؤولاً عن الديون التي تنشأ بعد **قيد وشهر** انسحابه أو إخراجه لدى السجل التجاري، ويظل مسؤولاً عن الديون التي نشأت قبل ذلك ما لم يُعفَ بموافقة باقي الشركاء ودائني الشركة.",
      "tags": [
        "انسحاب",
        "اخراج شريك",
        "انضمام",
        "ديون الشركه",
        "تضامن",
        "قيد وشهر"
      ]
    },
    {
      "no": 46,
      "titleAr": "إجراءات الانسحاب والإخراج",
      "verbatim": false,
      "text": "(1) ما لم ينص عقد تأسيس الشركة على غير ذلك، **للشريك الانسحاب بإرادته المنفردة** بشرط إبلاغ باقي الشركاء قبل (ستين) يوماً على الأقل من التاريخ الذي حدده للانسحاب. (2) يجوز الاتفاق في عقد التأسيس على إجراءات إخراج الشركاء؛ وإذا لم يتضمن العقد ذلك جاز **للأغلبية العددية** للشركاء التقدم إلى الجهة القضائية المختصة لإخراج شريك أو أكثر إذا كانت هناك أسباب مشروعة، وتظل الشركة قائمة بين باقي الشركاء.",
      "tags": [
        "اجراءات الانسحاب",
        "ستين يوما",
        "اخراج",
        "اغلبيه",
        "جهه قضائيه"
      ]
    },
    {
      "no": 156,
      "titleAr": "تعريف الشركة ذات المسؤولية المحدودة",
      "verbatim": false,
      "text": "الشركة ذات المسؤولية المحدودة: شركة يؤسسها شخص واحد أو أكثر من ذوي الصفة الطبيعية أو الاعتبارية، وتُعدّ ذمتها **مستقلة** عن الذمة المالية لكل شريك فيها أو المالك لها. وتكون الشركة وحدها مسؤولة عن الديون والالتزامات المترتبة عليها، **ولا يكون المالك ولا الشريك مسؤولاً عنها إلا بقدر حصته في رأس المال**.",
      "tags": [
        "مسؤوليه محدوده",
        "ذمه مستقله",
        "بقدر حصته",
        "راس المال"
      ]
    },
    {
      "no": 157,
      "titleAr": "الشركة ذات المسؤولية المحدودة من شخص واحد",
      "verbatim": false,
      "text": "في حال تأسيس الشركة ذات المسؤولية المحدودة من شخص واحد، أو إذا آلت جميع حصصها إلى شخص واحد: (أ) تكون لهذا الشخص صلاحيات المدير ومجلس المديرين والجمعية العامة للشركاء، وتصدر قراراته **كتابةً** وتُدوَّن في سجل خاص لدى الشركة. (ب) ويجوز له تعيين مدير أو أكثر يمثّل الشركة أمام القضاء والغير. ويكون للشركة المملوكة من شخص واحد **نظام أساس** يحلّ محلّ عقد التأسيس.",
      "tags": [
        "شخص واحد",
        "قرارات كتابيه",
        "نظام اساس",
        "مدير"
      ]
    },
    {
      "no": 281,
      "titleAr": "نفاذ النظام",
      "verbatim": true,
      "text": "يُعمل بالنظام بعد (مائة وثمانين) يوماً من تاريخ نشره في الجريدة الرسمية.",
      "tags": [
        "نفاذ",
        "مائه وثمانين يوما"
      ]
    }
  ],
  "verification": {
    "metadata": "primary_source",
    "articles": "primary_source",
    "checkedAt": "2026-08-22",
    "sources": [
      "https://mc.gov.sa/ar/do/com-2022.pdf"
    ],
    "notes": "قُرئ متن النظام من ملف وزارة التجارة (281 مادة؛ آخر مادة «الحادية والثمانون بعد المائتين»). ⚠️ استخراج النص أظهر انزياحاً لِگاتورياً منتظماً (لم↔مل، ال↔لا)، فأُصلح برمجياً ثم صيغت المواد يدوياً — لذلك verbatim=false لأغلبها والأرقام والمُدد حرفية. المحقون: ما يخصّ الشراكة والمسؤولية عملياً."
  }
}
