{
  "id": "commercial-fraud-1429",
  "family": "commercial",
  "nameAr": "نظام مكافحة الغش التجاري",
  "nameEn": "Anti-Commercial Fraud Law",
  "decree": "م/19",
  "hijriDate": "23/4/1429",
  "gregorianYear": 2008,
  "status": "in_force",
  "totalArticles": 30,
  "articles": [
    {
      "no": 2,
      "titleAr": "المخالفات — تسع صور",
      "text": "يُعدّ مخالفاً لأحكام النظام كل من: (1) خدع — أو شرع في الخداع — في ذاتية المنتج أو طبيعته أو نوعه أو عناصره أو صفاته الجوهرية، أو في مصدره، أو في قدره (وزناً أو كيلاً أو مقاساً أو عدداً أو طاقةً أو عياراً). (2) غشّ المنتج أو شرع فيه. (3) باع منتجاً مغشوشاً أو عرضه. (4) حاز منتجاً مغشوشاً بقصد المتاجرة. (5) صنع أو أنتج أو حاز أو باع أو عرض منتجات مخالفة للمواصفات القياسية المعتمدة. (6) استعمل أوانيَ أو أغلفةً أو عبواتٍ أو ملصقاتٍ مخالفة للمواصفات في التجهيز. (7) عبّأ أو حزم أو وزّع أو خزّن أو نقل بالمخالفة للمواصفات. (8) استورد أو صنع أو طبع أو حاز أو باع أو عرض عبواتٍ أو أغلفةً أو مطبوعاتٍ تُستعمل في الغش. (9) استورد منتجاً مغشوشاً.",
      "verbatim": false,
      "tags": [
        "غش",
        "مغشوش",
        "تقليد",
        "خداع",
        "صفات",
        "مصدر",
        "مواصفات",
        "استورد"
      ]
    },
    {
      "no": 3,
      "titleAr": "واجب الإبلاغ عند صرف منتج مغشوش",
      "text": "يلتزم المنتج والمستورد والموزّع لمنتج مغشوش — إذا صرفه — بإبلاغ الوزارة بالمعلومات المتعلقة بكميته وأسماء التجار الذين صُرف إليهم وعناوينهم، فور علمه أو إبلاغه بالمخالفة.",
      "verbatim": false,
      "tags": [
        "ابلاغ",
        "سحب",
        "موزع",
        "مستورد",
        "تبليغ"
      ]
    },
    {
      "no": 4,
      "titleAr": "التخفيضات والمسابقات تحتاج ترخيصاً",
      "text": "لا يجوز إجراء تخفيضات في أسعار المنتجات، أو إجراء مسابقات تجارية بأي وسيلة من الوسائل، دون الحصول على ترخيص من الوزارة.",
      "verbatim": true,
      "tags": [
        "تخفيضات",
        "خصم",
        "عروض",
        "مسابقه",
        "ترخيص",
        "سحب علي جوائز"
      ]
    },
    {
      "no": 16,
      "titleAr": "عقوبة مخالفات المادة (2)",
      "text": "يُعاقب بغرامة لا تزيد على خمسمائة ألف (500,000) ريال، أو السجن مدة لا تزيد على سنتين، أو بهما معاً، كل من ارتكب إحدى المخالفات المنصوص عليها في المادة (الثانية).",
      "verbatim": true,
      "tags": [
        "عقوبه",
        "غرامه",
        "سجن",
        "خمسمائه الف"
      ]
    },
    {
      "no": 17,
      "titleAr": "عقوبة التخفيضات بلا ترخيص",
      "text": "يُعاقب بغرامة لا تزيد على خمسين ألف (50,000) ريال، أو السجن مدة لا تزيد على ستة أشهر، أو بهما معاً، كل من ارتكب المخالفة المنصوص عليها في المادة (الرابعة).",
      "verbatim": true,
      "tags": [
        "عقوبه التخفيضات",
        "خمسين الف",
        "غرامه"
      ]
    },
    {
      "no": 18,
      "titleAr": "العقوبة المشدَّدة",
      "text": "يُعاقب بغرامة لا تزيد على (1,000,000) مليون ريال، أو بالسجن مدة لا تزيد على ثلاث سنوات، أو بهما معاً، في حالتين: (1) إذا اقترن فعل الخداع — أو الشروع فيه — باستعمال موازين أو مقاييس أو مكاييل أو دمغات أو آلات فحص مزيفة أو مخالفة، أو **كان المنتج المغشوش أو المواد المستعملة في غشه مضرّة بصحة الإنسان أو الحيوان**. (2) إذا ارتُكبت أي من المخالفات المنصوص عليها في المواد (3) و(7) و(9).",
      "verbatim": false,
      "tags": [
        "مشدده",
        "مليون",
        "مضره بالصحه",
        "موازين",
        "مزيفه"
      ]
    },
    {
      "no": 19,
      "titleAr": "التصرّف بمنتجات محجوزة",
      "text": "مع عدم الإخلال بعقوبات المادة (18)، يُعاقب من يتصرّف بمنتجات محجوزة بغرامة **تعادل قيمتها**.",
      "verbatim": false,
      "tags": [
        "محجوز",
        "حجز",
        "تصرف"
      ]
    },
    {
      "no": 20,
      "titleAr": "إغلاق المحل",
      "text": "مع عدم الإخلال بالعقوبات المنصوص عليها في النظام، يجوز الحكم بإغلاق المحل المخالف مدة لا تتجاوز سنة في المخالفات المنصوص عليها في المادة (الثانية).",
      "verbatim": false,
      "tags": [
        "اغلاق",
        "ايقاف المحل"
      ]
    },
    {
      "no": 21,
      "titleAr": "إتلاف المنتج المغشوش ومصادرة الأدوات",
      "text": "يترتب — في جميع الأحوال — على ثبوت غش المنتج إتلافه أو التصرف فيه بأي طريقة مناسبة، ومصادرة الأدوات التي استُعملت في الغش أو الخداع.",
      "verbatim": false,
      "tags": [
        "اتلاف",
        "مصادره",
        "ضبط"
      ]
    },
    {
      "no": 22,
      "titleAr": "سحب المنتج وإعادة قيمته للمشتري",
      "text": "مع عدم الإخلال بحق من أصابه ضرر في التعويض، يلتزم المخالف بسحب المنتج المغشوش **وإعادة قيمته إلى المشتري** وفق الشروط والإجراءات التي تحددها اللائحة.",
      "verbatim": false,
      "tags": [
        "استرداد",
        "اعاده القيمه",
        "تعويض",
        "سحب المنتج",
        "مشتري"
      ]
    },
    {
      "no": 24,
      "titleAr": "العَود",
      "text": "إذا عاد المخالف إلى ارتكاب أي من المخالفات خلال خمس سنوات من تاريخ صدور الحكم نهائياً، يُعاقب بعقوبة **لا تزيد على ضعف الحد الأعلى** للعقوبة المقررة، فإن عاد مرة أخرى حُرم من مزاولة النشاط التجاري مدة لا تزيد على خمس سنوات.",
      "verbatim": false,
      "tags": [
        "عود",
        "تكرار",
        "ضعف",
        "حرمان"
      ]
    },
    {
      "no": 25,
      "titleAr": "نشر ملخص الحكم",
      "text": "يُنشر — على نفقة المحكوم عليه — ملخص الحكم النهائي بالإدانة في جريدتين يوميتين، تصدر إحداهما في المنطقة التي وقعت فيها المخالفة أو أقرب منطقة لها.",
      "verbatim": false,
      "tags": [
        "نشر الحكم",
        "تشهير",
        "جريده"
      ]
    }
  ],
  "penaltyAmounts": [
    50000,
    500000,
    1000000
  ],
  "supersedes": [
    "نظام مكافحة الغش التجاري الصادر بالمرسوم الملكي م/11 وتاريخ 29/5/1404هـ"
  ],
  "appliesTo": [
    "غش",
    "منتج مغشوش",
    "مخالف للمواصفات",
    "تخفيضات بلا ترخيص",
    "مصادرة",
    "إتلاف"
  ],
  "verification": {
    "metadata": "primary_source",
    "articles": "primary_source",
    "checkedAt": "2026-08-21",
    "sources": [
      "https://faculty.ksu.edu.sa/sites/default/files/nzm_mkfh_lgsh_ltjry.pdf"
    ],
    "notes": "قُرئ متن النظام كاملاً (PDF على خادم جامعة الملك سعود) عبر pdftotext. الفصل الرابع = العقوبات، المواد 16–25. تُصحّح هنا نسبةٌ خاطئة سابقة للمادة 15 (الصواب 21)."
  },
  "aliases": [
    "الغش التجاري",
    "مكافحه الغش"
  ]
}