{
  "id": "trade-names-1446",
  "family": "commercial",
  "nameAr": "نظام الأسماء التجارية",
  "nameEn": "Trade Names Law",
  "decree": "م/83",
  "hijriDate": "19/3/1446",
  "gregorianYear": 2024,
  "status": "in_force",
  "aliases": [
    "الاسماء التجاريه"
  ],
  "appliesTo": [
    "اسم تجاري",
    "حجز اسم",
    "تسجيل اسم",
    "تغيير الاسم التجاري",
    "التنازل عن الاسم",
    "تجديد الاسم التجاري",
    "اسم مشابه",
    "اسم مضلل"
  ],
  "articles": [],
  "verification": {
    "metadata": "secondary_source",
    "articles": "none",
    "checkedAt": "2026-08-22",
    "sources": [
      "https://nezams.com/نظام-الأسماء-التجارية-2/",
      "https://lawfirm.com.sa/ar/نظام-الأسماء-التجارية-الجديد/",
      "https://qanoonsa.com/p/505002/"
    ],
    "notes": "صدر بالمرسوم م/83 (19/3/1446هـ) مع نظام السجل التجاري، ونفذ في **3 أبريل 2025م**. مؤكَّد من مصدرين: **يجوز التصرف في الاسم التجاري مستقلاً عن المتجر** (تغيير جوهري عن النظام السابق)، ويُجدَّد كل خمس سنوات، ويجوز تسجيله بغير العربية أو بحروف وأرقام. ⚠️ **أرقام المواد وسقف الغرامة (50,000 ريال ومضاعفتها عند التكرار خلال ثلاث سنوات) وردت في مصدر واحد فقط** — فلم تُحقن ولم يُسجَّل مبلغ، والبوابة ترفض أي رقم غرامة يُنسب لهذا النظام حتى يُقرأ المتن."
  }
}
