{
  "id": "pdpl-1443",
  "family": "administrative",
  "nameAr": "نظام حماية البيانات الشخصية",
  "status": "unverified",
  "articles": [],
  "appliesTo": [
    "بيانات شخصية",
    "خصوصية",
    "موافقة صاحب البيانات",
    "تسريب بيانات"
  ],
  "verification": {
    "metadata": "unverified",
    "articles": "none",
    "checkedAt": "2026-08-21",
    "sources": [],
    "notes": "النظام مدرج للتوجيه فقط: العقل يعرف أن المسألة تقع تحته، لكن لا يُستشهد بمادة ولا برقم غرامة منه حتى يُتحقَّق من متنه."
  }
}
