{
  "id": "labor-1426",
  "family": "labor",
  "nameAr": "نظام العمل",
  "nameEn": "Labor Law",
  "decree": "م/51",
  "hijriDate": "23/8/1426",
  "gregorianYear": 2005,
  "status": "in_force",
  "articles": [
    {
      "no": 74,
      "titleAr": "حالات انتهاء عقد العمل",
      "text": "ينتهي عقد العمل في أي من الحالات الآتية: (1) اتفاق الطرفين على إنهائه بشرط أن تكون موافقة العامل كتابية. (2) انتهاء المدة المحددة في العقد ما لم يكن قد تجدّد صراحةً أو ضمناً وفق أحكام النظام. (3) بناءً على إرادة أحد الطرفين في العقود غير محددة المدة وفقاً لأحكام المادة (75). (4) بلوغ العامل سن التقاعد وفق نظام التأمينات الاجتماعية ما لم يتفق الطرفان على الاستمرار في العمل بعدها.",
      "verbatim": false,
      "tags": [
        "انتهاء",
        "انهاء العقد",
        "تقاعد",
        "اتفاق",
        "مدة العقد"
      ]
    },
    {
      "no": 75,
      "titleAr": "مدة الإشعار في العقد غير محدد المدة",
      "text": "إذا كان العقد غير محدد المدة جاز لأي من الطرفين إنهاؤه بناءً على سبب مشروع يُذكر في إشعار كتابي يُوجَّه إلى الطرف الآخر قبل الإنهاء بمدة: **ستين (60) يوماً** إن كان العامل يتقاضى أجره شهرياً، و**ثلاثين (30) يوماً** لغيره.",
      "verbatim": false,
      "tags": [
        "اشعار",
        "انذار",
        "مهلة",
        "غير محدد المدة",
        "استقاله",
        "انهاء"
      ]
    },
    {
      "no": 76,
      "titleAr": "بدل الإشعار",
      "text": "إذا لم يراعِ أحد الطرفين مدة الإشعار المنصوص عليها في المادة (75)، لزمه أن يدفع للطرف الآخر تعويضاً يعادل **أجر العامل عن مدة الإشعار** أو عن المتبقّي منها. أي: 60 يوماً أجراً لمن يتقاضى أجره شهرياً إن أُنهي العقد فوراً بلا إشعار.",
      "verbatim": false,
      "tags": [
        "بدل اشعار",
        "تعويض الاشعار",
        "بلا اشعار",
        "فوري"
      ]
    },
    {
      "no": 77,
      "titleAr": "التعويض عن الإنهاء لسبب غير مشروع",
      "text": "ما لم يتضمن العقد تعويضاً محدداً مقابل إنهائه من أحد الطرفين لسبب غير مشروع، يستحق الطرف المتضرر من إنهاء العقد تعويضاً على النحو الآتي: (1) أجر خمسة عشر يوماً عن كل سنة من سنوات خدمة العامل إذا كان العقد غير محدد المدة. (2) أجر المدة الباقية من العقد إذا كان العقد محدد المدة. ويجب ألا يقل التعويض في الحالتين عن أجر العامل لمدة شهرين.",
      "verbatim": true,
      "tags": [
        "فصل تعسفي",
        "تعسفي",
        "سبب غير مشروع",
        "تعويض",
        "فصل",
        "دعوى"
      ]
    },
    {
      "no": 80,
      "titleAr": "الفسخ دون مكافأة ولا إشعار ولا تعويض (تسع حالات)",
      "text": "لا يجوز لصاحب العمل فسخ العقد دون مكافأة العامل أو إشعاره أو تعويضه إلا في الحالات الآتية، **وبشرط أن يتيح له الفرصة لكي يبدي أسباب معارضته للفسخ**: (1) الاعتداء على صاحب العمل أو المدير المسؤول أو أحد الرؤساء أثناء العمل أو بسببه. (2) عدم أداء الالتزامات الجوهرية أو عدم إطاعة الأوامر المشروعة أو مخالفة تعليمات السلامة **رغم إنذاره كتابياً**. (3) ثبوت اتّباعه سلوكاً سيئاً أو ارتكابه عملاً مخلاً بالشرف أو الأمانة. (4) تعمّده الإضرار مادياً بصاحب العمل (مع إبلاغ الجهات المختصة خلال 24 ساعة). (5) لجوؤه إلى التزوير للحصول على العمل. (6) كونه معيّناً تحت الاختبار. (7) **الغياب دون سبب مشروع أكثر من ثلاثين (30) يوماً خلال السنة الواحدة، أو أكثر من خمسة عشر (15) يوماً متتالية — على أن يسبق الفصل إنذار كتابي بعد الغياب عشرين (20) يوماً في الحالة الأولى وعشرة (10) أيام في الحالة الثانية.** (8) استغلال المركز الوظيفي بطريقة غير مشروعة لتحقيق مكاسب شخصية. (9) إفشاء الأسرار الصناعية أو التجارية.",
      "verbatim": false,
      "tags": [
        "فسخ",
        "غياب",
        "تغيب",
        "انذار كتابي",
        "بدون مكافاه",
        "سلوك",
        "تزوير",
        "اختبار"
      ]
    },
    {
      "no": 81,
      "titleAr": "حق العامل في ترك العمل دون إشعار مع احتفاظه بحقوقه",
      "text": "يحق للعامل أن يترك العمل دون إشعار مع احتفاظه بحقوقه النظامية كلها في أحوال منها: عدم وفاء صاحب العمل بالتزاماته العقدية أو النظامية الجوهرية؛ أو ثبوت إدخال الغش عليه وقت التعاقد بشأن شروط العمل وظروفه؛ أو تكليفه دون رضاه بعمل يختلف جوهرياً عن العمل المتفق عليه؛ أو اتّسام معاملة صاحب العمل أو المدير المسؤول بالقسوة أو الجور أو الإهانة. ⚠️ هذه المادة **حقٌّ للعامل** لا لصاحب العمل — لا تُستخدم لتبرير الفصل.",
      "verbatim": false,
      "tags": [
        "ترك العمل",
        "حقوق العامل",
        "غش",
        "قسوه",
        "اهانه",
        "استقاله"
      ]
    },
    {
      "no": 84,
      "titleAr": "مكافأة نهاية الخدمة",
      "text": "إذا انتهت العلاقة العمالية وجب على صاحب العمل أن يدفع للعامل مكافأة نهاية خدمة عن مدة خدمته تُحسب على أساس: **أجر نصف شهر عن كل سنة من السنوات الخمس الأولى، وأجر شهر كامل عن كل سنة من السنوات التالية**، ويُتّخذ الأجر الأخير أساساً لحسابها، ويستحق العامل مكافأة عن أجزاء السنة بنسبة ما قضاه منها في العمل. ⚠️ هذه هي **المكافأة** لا التعويض عن الفصل — التعويض في المادة (77) ويُجمعان معاً.",
      "verbatim": false,
      "tags": [
        "مكافاه نهايه الخدمه",
        "مكافاه",
        "نهايه الخدمه",
        "حساب"
      ]
    },
    {
      "no": 85,
      "titleAr": "مكافأة نهاية الخدمة عند استقالة العامل",
      "text": "إذا انتهت العلاقة العمالية بسبب استقالة العامل استحق: **ثلث المكافأة** إذا بلغت مدة خدمته سنتين متتاليتين فأكثر ولم تزد على خمس سنوات؛ و**ثلثي المكافأة** إذا زادت على خمس سنوات ولم تبلغ عشر سنوات؛ و**المكافأة كاملة** إذا بلغت عشر سنوات فأكثر. ولا يستحق شيئاً إن قلّت خدمته عن سنتين.",
      "verbatim": false,
      "tags": [
        "استقاله",
        "استقال",
        "ثلث",
        "ثلثين",
        "مكافاه"
      ]
    }
  ],
  "amendments": [
    "المرسوم الملكي م/46 وتاريخ 5/6/1436هـ"
  ],
  "appliesTo": [
    "عامل",
    "موظف",
    "فصل",
    "استقالة",
    "مكافأة نهاية الخدمة",
    "إشعار",
    "غياب",
    "أجر"
  ],
  "verification": {
    "metadata": "secondary_source",
    "articles": "two_secondary_sources",
    "checkedAt": "2026-08-21",
    "sources": [
      "https://sgmtlaw.sa/المادة-77-من-نظام-العمل/",
      "https://manielaw-sa.com/المادة-80-من-نظام-العمل/",
      "https://www.arablawfirm.org/2024/04/08/أحكام-المادة-80-من-نظام-العمل-السعودي/",
      "https://law.shangiti.com/blogs/end-of-service-benefits-calculation-saudi-article-84-85"
    ],
    "notes": "المواد 74–85 (نواة إنهاء العقد ومكافأة نهاية الخدمة) — مصدران لكل مادة. العدد الإجمالي للنظام لم يُتحقَّق منه بعد."
  }
}
