{
  "id": "civil-transactions-1444",
  "family": "administrative",
  "nameAr": "نظام المعاملات المدنية",
  "nameEn": "Civil Transactions Law",
  "decree": "م/191",
  "hijriDate": "29/11/1444",
  "gregorianYear": 2023,
  "status": "in_force",
  "totalArticles": 721,
  "appliesTo": [
    "إخلال",
    "إخلال بالعقد",
    "اتفاق",
    "استحالة التنفيذ",
    "التزام",
    "التزام تعاقدي",
    "المبيع",
    "بطلان",
    "بند في العقد",
    "تعويض",
    "تفسير العقد",
    "تقادم",
    "ضرر",
    "ضمان",
    "عقد",
    "عيب",
    "عيب خفي",
    "فسخ العقد",
    "مطالبة"
  ],
  "articles": [
    {
      "no": 104,
      "titleAr": "تفسير العقد",
      "verbatim": false,
      "text": "(1) إذا كانت عبارة العقد واضحةً فلا يُعدل عن مدلولها بحجة تفسيرها بحثاً عن إرادة المتعاقدين. (2) وإذا كان هناك محل لتفسير العقد وجب البحث عن **الإرادة المشتركة** للمتعاقدين دون الاكتفاء بالمعنى الحرفي للألفاظ، ويُستهدى في ذلك بالعرف وظروف العقد وطبيعة المعاملة.",
      "tags": [
        "تفسير العقد",
        "اراده مشتركه",
        "عرف"
      ]
    },
    {
      "no": 110,
      "titleAr": "انفساخ العقد لاستحالة التنفيذ",
      "verbatim": false,
      "text": "(1) في العقود الملزمة للجانبين، إذا أصبح تنفيذ الالتزام **مستحيلاً بسبب لا يد للمدين فيه** انقضى التزامه والالتزام المقابل له، وانفسخ العقد من تلقاء نفسه. (2) وإذا كانت الاستحالة جزئية انقضى الالتزام في الجزء المستحيل وما يقابله فقط.",
      "tags": [
        "استحاله",
        "انفساخ",
        "قوه قاهره",
        "التزام"
      ]
    },
    {
      "no": 338,
      "titleAr": "ضمان البائع سلامة المبيع من العيب",
      "verbatim": false,
      "text": "(1) **يضمن البائع عند تسليم المبيع سلامته من أي عيب** ينقص من قيمته أو من نفعه بحسب الغاية المقصودة منه، المستفادة مما هو مبيّن في العقد أو ظاهر من طبيعة الشيء أو الغرض الذي أُعدّ له — **ويضمن البائع هذا العيب ولو لم يكن عالماً بوجوده**. (2) وإذا ظهر في المبيع عيب كان المشتري **مخيّراً بين طلب فسخ البيع، أو إمساك المبيع والرجوع على البائع بفرق الثمن** (وهو نسبة قيمة المبيع سليماً إلى قيمته معيباً من الثمن)؛ وللبائع أن يتوقّى ذلك بإحضار **بديل مماثل** غير معيب. (3) وللمشتري في هذه الحالات **الحق في التعويض** عمّا يلحقه من ضرر.",
      "tags": [
        "عيب",
        "ضمان العيب",
        "المبيع",
        "فسخ البيع",
        "فرق الثمن",
        "بديل",
        "تعويض"
      ]
    },
    {
      "no": 339,
      "titleAr": "حالات لا يضمن فيها البائع العيب",
      "verbatim": false,
      "text": "لا يضمن البائع العيب في الحالات الآتية: (أ) إذا كان المشتري **يعلم بالعيب** وقت البيع، أو كان يستطيع أن يتبيّنه بنفسه لو فحص المبيع بعناية الشخص المعتاد — ما لم يضمن البائع سلامة المبيع من عيب بعينه، أو كان البائع **تعمّد إخفاءه**. (ب) إذا كان العيب مما جرى العرف على التسامح فيه.",
      "tags": [
        "لا ضمان",
        "علم المشتري",
        "فحص معتاد",
        "اخفاء العيب",
        "عرف"
      ]
    },
    {
      "no": 340,
      "titleAr": "واجب المشتري في الفحص والإخطار",
      "verbatim": false,
      "text": "(1) إذا تسلّم المشتري المبيع فعليه التحقق من حالته **بمجرد أن يتمكّن** من ذلك وفقاً للمألوف في التعامل؛ فإذا كشف عيباً يضمنه البائع فعليه إعلامه به **خلال مدة معقولة**، فإن لم يفعل عُدّ قابلاً للمبيع بما فيه من عيب. (2) وإذا كان العيب مما لا يمكن كشفه بالفحص المعتاد ثم كشفه المشتري، فعليه إعلام البائع **بمجرد ظهوره**، وإلا عُدّ قابلاً للمبيع بما فيه من عيب.",
      "tags": [
        "فحص المبيع",
        "اخطار",
        "مده معقوله",
        "سقوط الحق"
      ]
    },
    {
      "no": 721,
      "titleAr": "نفاذ النظام",
      "verbatim": true,
      "text": "يُعمل بهذا النظام بعد مضي (مائة وثمانين) يوماً من تاريخ نشره في الجريدة الرسمية، ويُلغي كل ما يتعارض معه من أحكام.",
      "tags": [
        "نفاذ",
        "الغاء المتعارض"
      ]
    }
  ],
  "verification": {
    "metadata": "primary_source",
    "articles": "primary_source",
    "checkedAt": "2026-08-22",
    "sources": [
      "https://qadha.org.sa/files/shares/نظام المعاملات المدنية مع الفهارس.pdf"
    ],
    "notes": "قُرئ المتن (721 مادة) عبر pdftotext مع إصلاح الانزياح اللِگاتوري، ثم صيغت المواد يدوياً. **هذا هو مرجع العيب والضمان** الذي كانت بوابة المضمون تحيل إليه بلا مواد: المادة (338) تضمن سلامة المبيع ولو لم يعلم البائع، والمادة (340) تُسقط الحق بالتأخر في الإخطار. النظام نُشر في أم القرى 1/12/1444هـ ونفذ بعد 180 يوماً."
  },
  "aliases": [
    "المعاملات المدنيه",
    "القانون المدني",
    "النظام المدني"
  ]
}
