{
  "id": "cybercrime-1428",
  "family": "administrative",
  "nameAr": "نظام مكافحة جرائم المعلوماتية",
  "nameEn": "Anti-Cyber Crime Law",
  "decree": "م/17",
  "hijriDate": "8/3/1428",
  "gregorianYear": 2007,
  "status": "in_force",
  "totalArticles": 16,
  "appliesTo": [
    "ابتزاز إلكتروني",
    "اختراق",
    "اختراق بيانات بنكية",
    "برمجية خبيثة",
    "بيانات بنكية",
    "تشهير",
    "تصيد",
    "تعطيل شبكة",
    "تنصت",
    "حساب مخترق",
    "دخول غير مشروع",
    "دخول غير مصرح",
    "سرقة بيانات",
    "نسخ بيانات"
  ],
  "penaltyAmounts": [
    500000,
    2000000,
    3000000,
    5000000
  ],
  "articles": [
    {
      "no": 3,
      "titleAr": "عقوبة التنصت والتشهير والمساس بالحياة الخاصة",
      "verbatim": false,
      "text": "السجن مدة لا تزيد على **سنة** وغرامة لا تزيد على **(500,000) خمسمائة ألف ريال**، أو إحدى العقوبتين — ومن صوره: التنصت على ما هو مرسل عن طريق الشبكة المعلوماتية دون مسوّغ نظامي، والتشهير بالآخرين وإلحاق الضرر بهم عبر وسائل تقنيات المعلومات.",
      "tags": [
        "تنصت",
        "تشهير",
        "حياه خاصه",
        "سنه",
        "خمسمائه الف"
      ]
    },
    {
      "no": 4,
      "titleAr": "الاستيلاء الاحتيالي والوصول غير المشروع للبيانات البنكية",
      "verbatim": false,
      "text": "السجن مدة لا تزيد على **ثلاث سنوات** وغرامة لا تزيد على **(2,000,000) مليوني ريال**، أو إحدى العقوبتين — للاستيلاء على مال أو سند عن طريق الاحتيال أو انتحال صفة كاذبة، والوصول غير المشروع إلى بيانات بنكية أو ائتمانية.",
      "tags": [
        "احتيال",
        "بيانات بنكيه",
        "انتحال صفه",
        "مليونين"
      ]
    },
    {
      "no": 5,
      "titleAr": "إتلاف البيانات وتعطيل الشبكة",
      "verbatim": false,
      "text": "السجن مدة لا تزيد على **أربع سنوات** وغرامة لا تزيد على **(3,000,000) ثلاثة ملايين ريال**، أو إحدى العقوبتين — للدخول غير المشروع بقصد حذف البيانات أو إتلافها أو تعديلها، ولتعطيل الشبكة المعلوماتية أو إيقافها.",
      "tags": [
        "اتلاف بيانات",
        "تعطيل الشبكه",
        "حذف",
        "اربع سنوات"
      ]
    },
    {
      "no": 6,
      "titleAr": "المحتوى المخل والاتجار المحظور إلكترونياً",
      "verbatim": false,
      "text": "السجن مدة لا تزيد على **خمس سنوات** وغرامة لا تزيد على **(3,000,000) ثلاثة ملايين ريال**، أو إحدى العقوبتين — لإنتاج ما يمسّ النظام العام أو الآداب أو إعداده أو إرساله عبر الشبكة، ولإنشاء المواقع للاتجار المحظور.",
      "tags": [
        "محتوي مخل",
        "اداب",
        "اتجار محظور",
        "خمس سنوات"
      ]
    },
    {
      "no": 7,
      "titleAr": "الجرائم الماسّة بالأمن الوطني",
      "verbatim": false,
      "text": "السجن مدة لا تزيد على **عشر سنوات** وغرامة لا تزيد على **(5,000,000) خمسة ملايين ريال**، أو إحدى العقوبتين — لإنشاء موقع لمنظمة إرهابية أو ترويجها، وللدخول غير المشروع إلى موقع أو نظام حكومي أو بيانات تمسّ الأمن الوطني أو الاقتصاد الوطني.",
      "tags": [
        "امن وطني",
        "ارهاب",
        "موقع حكومي",
        "عشر سنوات",
        "خمسه ملايين"
      ]
    },
    {
      "no": 8,
      "titleAr": "تغليظ العقوبة",
      "verbatim": false,
      "text": "لا تقل العقوبة عن **نصف حدّها الأعلى** إذا اقترنت الجريمة بظروف منها: ارتكابها عبر عصابة منظمة، أو شغل الجاني وظيفة عامة استغلها، أو تغرير القاصرين، أو صدور أحكام سابقة عليه في جرائم مماثلة.",
      "tags": [
        "تغليظ",
        "عصابه منظمه",
        "موظف عام",
        "عود"
      ]
    },
    {
      "no": 9,
      "titleAr": "التحريض والمساعدة",
      "verbatim": false,
      "text": "يُعاقب المحرِّض أو المساعد أو المتفق على ارتكاب أي من جرائم النظام إذا وقعت الجريمة بناءً على ذلك، بما لا يتجاوز **الحدّ الأعلى** للعقوبة المقررة.",
      "tags": [
        "تحريض",
        "مساعده",
        "اتفاق جنائي"
      ]
    }
  ],
  "verification": {
    "metadata": "secondary_source",
    "articles": "two_secondary_sources",
    "checkedAt": "2026-08-21",
    "sources": [
      "https://www.wipo.int/wipolex/ar/legislation/details/14570",
      "https://nezams.com/نظام-مكافحة-جرائم-المعلوماتية/"
    ],
    "notes": "المصدران اتفقا على العدد الإجمالي (16 مادة) وعلى كل شرائح العقوبة في المواد 3–7. متن وزارة المالية PDF مصوَّر لا يُستخرج نصّه، فلم يُعتمد."
  },
  "aliases": [
    "الجرائم المعلوماتيه",
    "جرائم المعلوماتيه",
    "الجرائم الالكترونيه"
  ]
}
