{
  "id": "customs-1423",
  "family": "commercial",
  "nameAr": "نظام (قانون) الجمارك الموحد لدول مجلس التعاون",
  "nameEn": "GCC Unified Customs Law",
  "decree": "م/41",
  "hijriDate": "3/11/1423",
  "gregorianYear": 2003,
  "status": "in_force",
  "totalArticles": 179,
  "aliases": [
    "الجمارك",
    "نظام الجمارك",
    "الجمارك الموحد",
    "التعرفه الجمركيه",
    "جمركي"
  ],
  "appliesTo": [
    "استيراد",
    "تصدير",
    "جمارك",
    "رسوم جمركية",
    "تعرفة",
    "شحنة",
    "بيان جمركي",
    "تهريب",
    "إعادة تصدير",
    "منشأ",
    "بضاعة واردة",
    "تخليص",
    "منفذ جمركي",
    "ممنوعات"
  ],
  "articles": [
    {
      "no": 142,
      "titleAr": "تعريف التهريب",
      "verbatim": true,
      "text": "التهريب هو **إدخال أو محاولة إدخال البضائع إلى البلاد أو إخراجها أو محاولة إخراجها منها بصورة مخالفة للتشريعات المعمول بها**، دون أداء الضرائب «الرسوم» الجمركية كلياً أو جزئياً، أو خلافاً لأحكام المنع أو التقييد الواردة في هذا النظام والأنظمة الأخرى.",
      "tags": [
        "تهريب",
        "بلا رسوم",
        "منع",
        "تقييد",
        "ادخال",
        "اخراج"
      ]
    },
    {
      "no": 143,
      "titleAr": "ما يدخل في حكم التهريب",
      "verbatim": false,
      "text": "يدخل في حكم التهريب بصورة خاصة: **عدم التوجه بالبضائع عند الإدخال إلى أول دائرة جمركية** · عدم اتباع الطرق المحددة للإدخال والإخراج · التفريغ أو التحميل بصورة مغايرة للأنظمة · **عدم التصريح في الدائرة الجمركية عن البضائع الواردة أو الصادرة دون بيان حمولة — ويدخل في ذلك ما يصطحبه المسافرون من بضائع ذات صفة تجارية** · وتجاوز البضائع للنطاق الجمركي بلا إجراء.",
      "tags": [
        "حكم التهريب",
        "بيان حموله",
        "صفه تجاريه",
        "مسافرون",
        "دائره جمركيه"
      ]
    },
    {
      "no": 144,
      "titleAr": "المسؤولية الجزائية في التهريب",
      "verbatim": false,
      "text": "يُشترط لقيام المسؤولية الجزائية في جرم التهريب **توفّر القصد**. ويُعدّ مسؤولاً جزائياً بصورة خاصة: الفاعلون الأصليون · الشركاء · المتدخلون والمحرّضون · **حائزو المواد المهرَّبة** · أصحاب وسائط النقل وسائقوها ممن تثبت علاقتهم · وأصحاب أو مستأجرو المحال التي أُودعت فيها المهرَّبات **ممن يثبت علمهم** بوجودها.",
      "tags": [
        "اتلاف",
        "اقرار",
        "بضاعه مقلده",
        "جرم",
        "حائز",
        "شركاء",
        "علم",
        "قصد",
        "لا مسؤوليه بلا قصد",
        "متهم",
        "مسؤوليه جزائيه"
      ],
      "core": true
    },
    {
      "no": 145,
      "titleAr": "عقوبة التهريب",
      "verbatim": false,
      "text": "مع عدم الإخلال بأي عقوبة أشد، يُعاقب على التهريب وما في حكمه وعلى الشروع فيه: (1) إذا كانت البضاعة تخضع لرسوم جمركية مرتفعة: غرامة **لا تقل عن مثلَي الرسوم المستحقة ولا تزيد على ثلاثة أمثالها، أو مثلَي قيمة البضاعة أيهما أعلى**، والحبس **من شهر إلى سنة**، أو إحدى العقوبتين. (2) وفي السلع الأخرى: غرامة **لا تقل عن مثلَي الرسوم ولا تزيد على قيمة البضاعة**، والحبس من شهر إلى سنة، أو إحدى العقوبتين.",
      "tags": [
        "اقرار اتلاف",
        "ثلاثه امثال",
        "حبس",
        "سنه",
        "شهر",
        "عقوبه",
        "عقوبه التهريب",
        "غرامه جمركيه",
        "مثلي الرسوم"
      ],
      "core": true
    },
    {
      "no": 16,
      "titleAr": "خضوع البضائع المهرَّبة للتعرفة النافذة",
      "verbatim": false,
      "text": "تخضع **البضائع المهرَّبة أو التي في حكم المهرَّبة** للتعرفة الجمركية النافذة في تاريخ ضبطها.",
      "tags": [
        "تعرفه",
        "مهربه",
        "تاريخ الضبط"
      ]
    },
    {
      "no": 27,
      "titleAr": "الفاتورة الأصلية مع البيان الجمركي",
      "verbatim": false,
      "text": "يُشترط لقبول القيمة كعنصر مميِّز للبضاعة أن **تُقدَّم مع كل بيان جمركي فاتورة تفصيلية أصلية** تتضمن العناصر المميِّزة للبضاعة.",
      "tags": [
        "فاتوره اصليه",
        "بيان جمركي",
        "قيمه",
        "عناصر مميزه"
      ]
    }
  ],
  "verification": {
    "metadata": "primary_source",
    "articles": "primary_source",
    "checkedAt": "2026-08-22",
    "sources": [
      "https://zatca.gov.sa/ar/RulesRegulations/Taxes/Documents/customs%20law.pdf",
      "https://laws.boe.gov.sa/BoeLaws/Laws/LawDetails/b93d0275-775f-482a-9d52-a9a700f2ca15/1"
    ],
    "notes": "🔴 **الاستيراد والتصدير في المملكة لا يحكمه نظام سعودي منفرد** بل النظام (القانون) الموحد للجمارك لدول مجلس التعاون، الذي أُقرّ في المملكة بالمرسوم الملكي **م/41 وتاريخ 3/11/1423هـ**. قُرئ المتن من ملف هيئة الزكاة والضريبة والجمارك (179 مادة + لائحة تنفيذية). المحقون: تعريف التهريب وأحكامه وعقوبته والفاتورة الأصلية — وهي ما يمسّ المستورد عملياً. ⚠️ **الغرامات هنا نِسَبٌ من الرسوم أو قيمة البضاعة لا مبالغ ثابتة**، فلا `penaltyAmounts` — وأي رقم غرامة ثابت يُنسب لهذا النظام يُرصد."
  },
  "ratioPenalties": true
}